{
  "schema_version": 1,
  "transaction_id": "update-20260721t215500z-a1b2c3d4",
  "sequence": 4,
  "state": "backed_up",
  "source_version": "0.1.0-preview.4",
  "target_version": "0.2.0-preview.1",
  "created_at": "2026-07-21T21:55:00Z",
  "updated_at": "2026-07-21T22:00:01Z",
  "backup_id": "backup-20260721t220000z-a1b2c3d4",
  "failure": null,
  "recovery_action": "resume"
}
